{"route_decision_id":"EQA-ROUTE-EXAMPLE-001","task_type":"file hash validation","risk_level":"moderate","data_class":"internal","route_class":"deterministic","route_id":"local-validator","capability_scope":"hashes and schema","version":"validator-v1","confidentiality_status":"approved","evidence_retention":"retain result","human_checkpoint":"sample","status":"approved","rationale":"Deterministic route is appropriate."}
